{
  "$schema": "https://json-schema.org/draft/2020-12/schema",
  "$id": "https://zorbit.scalatics.com/schemas/module-manifest/manifest.schema.json",
  "title": "Zorbit Module Manifest v2",
  "description": "Complete module manifest schema. Every Zorbit module (platform service or business app) registers itself with the platform by providing this manifest. This is the contract between a module and the Zorbit platform.",
  "type": "object",
  "required": ["moduleId", "moduleName", "moduleType", "version", "placement", "registration"],
  "properties": {
    "moduleId": {
      "type": "string",
      "description": "Unique identifier for the module, using underscore word separator. Examples: identity, authorization, pfs_datatable, app_hi_quotation.",
      "pattern": "^[a-z][a-z0-9_]*$"
    },
    "moduleName": {
      "type": "string",
      "description": "Human-readable display name for the module."
    },
    "moduleType": {
      "type": "string",
      "enum": ["cor", "pfs", "app", "tpm", "sdk"],
      "description": "Module type matching the repository type prefix: cor=core platform, pfs=platform feature service, app=business application, tpm=third-party module, sdk=SDK library."
    },
    "version": {
      "type": "string",
      "pattern": "^\\d+\\.\\d+\\.\\d+$",
      "description": "Semantic version of the module."
    },
    "description": {
      "type": "string",
      "description": "Brief description of what this module does."
    },
    "owner": {
      "type": "string",
      "description": "Team or organization that owns this module."
    },
    "icon": {
      "type": "string",
      "description": "Lucide or Material Design icon name for the module."
    },
    "color": {
      "type": "string",
      "pattern": "^#[0-9a-fA-F]{6}$",
      "description": "Brand color for the module in hex format."
    },
    "navigation": {
      "type": "object",
      "description": "Menu sections and items this module contributes to the navigation sidebar.",
      "properties": {
        "sections": {
          "type": "array",
          "items": {
            "$ref": "#/$defs/NavigationSection"
          }
        }
      },
      "required": ["sections"]
    },
    "frontend": {
      "type": "object",
      "description": "Frontend bundle and routing configuration for micro-frontend loading.",
      "properties": {
        "bundleUrl": {
          "type": "string",
          "format": "uri",
          "description": "Full URL to the module frontend bundle. Must be a complete URL, not a relative path."
        },
        "loadStrategy": {
          "type": "string",
          "enum": ["eager", "lazy", "on-demand"],
          "description": "When to load the frontend bundle. eager=on app start, lazy=on first route match, on-demand=explicit user action."
        },
        "entryComponent": {
          "type": "string",
          "description": "Name of the root React/Angular component exported by the bundle."
        },
        "routes": {
          "type": "array",
          "items": { "type": "string" },
          "description": "Frontend route patterns this module handles (supports wildcards)."
        }
      }
    },
    "backend": {
      "type": "object",
      "description": "Backend service configuration and endpoint declarations.",
      "required": ["baseUrl", "healthEndpoint"],
      "properties": {
        "baseUrl": {
          "type": "string",
          "description": "Base URL of the backend service (e.g. http://localhost:3113)."
        },
        "healthEndpoint": {
          "type": "string",
          "description": "Health check endpoint path."
        },
        "apiPrefix": {
          "type": "string",
          "description": "Common API prefix for all endpoints (e.g. /api/v1/O/{orgId}/hi-quotation)."
        },
        "endpoints": {
          "type": "array",
          "items": {
            "$ref": "#/$defs/BackendEndpoint"
          }
        }
      }
    },
    "dashboard": {
      "type": "object",
      "description": "Dashboard widgets this module contributes.",
      "properties": {
        "widgets": {
          "type": "array",
          "items": {
            "$ref": "#/$defs/DashboardWidget"
          }
        }
      }
    },
    "reporting": {
      "type": "object",
      "description": "Reporting data sources this module exposes for ad-hoc queries and scheduling.",
      "properties": {
        "dataSources": {
          "type": "array",
          "items": {
            "$ref": "#/$defs/ReportingDataSource"
          }
        },
        "schedulable": {
          "type": "boolean",
          "description": "Whether reports from this module can be scheduled for periodic generation."
        }
      }
    },
    "seeding": {
      "type": "object",
      "description": "Seed data configuration for the seeding service.",
      "properties": {
        "seedEndpoint": {
          "type": "string",
          "description": "Endpoint to trigger seeding."
        },
        "flushEndpoint": {
          "type": "string",
          "description": "Endpoint to flush/reset seed data."
        },
        "profiles": {
          "type": "object",
          "description": "Named seed profiles with descriptions and record counts.",
          "additionalProperties": {
            "$ref": "#/$defs/SeedProfile"
          }
        },
        "dependencies": {
          "type": "array",
          "items": { "type": "string" },
          "description": "Modules that must be seeded before this one."
        }
      }
    },
    "events": {
      "type": "object",
      "description": "Kafka events this module publishes and subscribes to.",
      "properties": {
        "publishes": {
          "type": "array",
          "items": { "type": "string" },
          "description": "Events this module publishes (domain.entity.action format)."
        },
        "subscribes": {
          "type": "array",
          "items": { "type": "string" },
          "description": "Events this module consumes."
        }
      }
    },
    "database": {
      "type": "object",
      "description": "Database configuration for this module.",
      "properties": {
        "type": {
          "type": "string",
          "enum": ["mongodb", "postgresql", "sqlite", "mariadb"],
          "description": "Database engine used by this module."
        },
        "name": {
          "type": "string",
          "description": "Database name."
        },
        "collections": {
          "type": "array",
          "items": { "type": "string" },
          "description": "Collection/table names managed by this module."
        }
      }
    },
    "dependencies": {
      "type": "object",
      "description": "Module dependencies for startup ordering, health checks, and circuit breakers.",
      "properties": {
        "platform": {
          "type": "array",
          "items": { "type": "string" },
          "description": "Platform services this module depends on."
        },
        "business": {
          "type": "array",
          "items": { "type": "string" },
          "description": "Business application modules this module depends on."
        }
      }
    },
    "pii": {
      "type": "object",
      "description": "PII handling configuration for the PII vault integration.",
      "properties": {
        "autoDetect": {
          "type": "boolean",
          "description": "Whether the SDK interceptor should auto-detect PII in write operations."
        },
        "declaredFields": {
          "type": "array",
          "items": {
            "$ref": "#/$defs/PiiField"
          },
          "description": "Explicitly declared PII fields for proactive tokenization."
        }
      }
    },
    "analytics": {
      "type": "object",
      "description": "Observability and analytics configuration.",
      "properties": {
        "grafanaDashboard": {
          "type": "string",
          "description": "Grafana dashboard slug for this module."
        },
        "metrics": {
          "type": "array",
          "items": {
            "$ref": "#/$defs/MetricDefinition"
          }
        }
      }
    },
    "placement": {
      "type": "object",
      "description": "Where this module sits in the platform hierarchy: Edition > Business Line > Capability Area",
      "required": ["edition", "businessLine", "capabilityArea"],
      "properties": {
        "edition": {
          "type": "string",
          "description": "Platform edition this module belongs to. Examples: insurer, distributor, tpa, reinsurer, regulator, uhc, platform",
          "examples": ["insurer", "distributor", "platform"]
        },
        "businessLine": {
          "type": "string",
          "description": "Business line within the edition. Examples: distribution, servicing, finance, platform-core, platform-feature-services",
          "examples": ["distribution", "servicing", "platform-core"]
        },
        "capabilityArea": {
          "type": "string",
          "description": "Capability area within the business line. Examples: product-management, policy-admin, claims, ai-automation",
          "examples": ["product-management", "policy-admin", "claims"]
        },
        "sortOrder": {
          "type": "integer",
          "description": "Sort order within the capability area. Lower = appears first."
        }
      }
    },
    "registration": {
      "type": "object",
      "description": "Kafka-based self-registration configuration. The module publishes this on startup.",
      "required": ["kafkaTopic", "manifestUrl"],
      "properties": {
        "kafkaTopic": {
          "type": "string",
          "description": "Kafka topic to publish announcements to.",
          "const": "platform.module.announcements"
        },
        "manifestUrl": {
          "type": "string",
          "format": "uri",
          "description": "Public URL where the registry can fetch the full manifest. Must be a complete URL."
        }
      }
    }
  },
  "$defs": {
    "NavigationSection": {
      "type": "object",
      "required": ["label", "sortOrder", "items"],
      "properties": {
        "id": {
          "type": "string",
          "description": "Section identifier. When set to one of the canonical group ids ('guide', 'data', 'setup', 'deployment'), the SPA renders the section as a named wrapper node nested under the module. Other ids render flat (back-compat).",
          "examples": ["guide", "data", "setup", "deployment", "identity", "operations"]
        },
        "groupId": {
          "type": "string",
          "enum": ["guide", "data", "setup", "deployment"],
          "description": "Optional explicit canonical group id. Overrides the section's `id` for grouping purposes. Use when you want a custom section label but still want the SPA to nest items under the canonical wrapper. When neither `groupId` nor a canonical `id` is set, the section renders flat under the module."
        },
        "label": {
          "type": "string",
          "description": "Display label for the menu section. When the section is a canonical group, this label is shown on the group wrapper node (e.g. 'Guide', 'Data', 'Setup', 'Deployment')."
        },
        "icon": {
          "type": "string",
          "description": "Material Design or Lucide icon name."
        },
        "sortOrder": {
          "type": "integer",
          "description": "Sort order for the section. Lower numbers appear first."
        },
        "privilege": {
          "type": "string",
          "description": "Privilege code required to see this section."
        },
        "items": {
          "type": "array",
          "items": {
            "$ref": "#/$defs/NavigationItem"
          }
        }
      }
    },
    "NavigationItem": {
      "type": "object",
      "required": ["label", "feRoute", "sortOrder"],
      "properties": {
        "label": {
          "type": "string",
          "description": "Display label for the menu item."
        },
        "feRoute": {
          "type": "string",
          "pattern": "^/m/",
          "description": "Frontend route. Must start with /m/ — no org scope allowed in FE routes."
        },
        "beRoute": {
          "type": "string",
          "description": "Backend API route. Supports Handlebars templates: {{org_id}}."
        },
        "privilege": {
          "type": "string",
          "description": "Privilege code required to see this item."
        },
        "sortOrder": {
          "type": "integer",
          "description": "Sort order within the section."
        },
        "icon": {
          "type": "string",
          "description": "Icon for this specific menu item."
        },
        "feComponent": {
          "type": "string",
          "description": "Frontend component reference, in the form `<bundle>:<component>` or `@platform:<component>`. Used by the SPA to mount the right widget for the route. The platform special-cases @platform:Guide* component names to nest items under the Guide group when the manifest does not set a section id."
        },
        "groupId": {
          "type": "string",
          "enum": ["guide", "data", "setup", "deployment"],
          "description": "Optional canonical group id at the item level. When set, the item is moved into the named group wrapper regardless of which manifest section declared it. Useful for one-off items (e.g. a single 'DB Operations' link) without creating a whole section. Items inside a section already tagged with a canonical id/groupId inherit the section's group; the item-level field overrides."
        },
        "visibleInMenu": {
          "type": "boolean",
          "default": true,
          "description": "Whether this item appears in the navigation menu."
        }
      }
    },
    "BackendEndpoint": {
      "type": "object",
      "required": ["method", "path"],
      "properties": {
        "method": {
          "type": "string",
          "enum": ["GET", "POST", "PUT", "PATCH", "DELETE"]
        },
        "path": {
          "type": "string",
          "description": "Endpoint path relative to apiPrefix."
        },
        "privilege": {
          "type": "string",
          "description": "Privilege code required to access this endpoint."
        },
        "description": {
          "type": "string"
        }
      }
    },
    "DashboardWidget": {
      "type": "object",
      "required": ["widgetId", "type", "label", "dataEndpoint"],
      "properties": {
        "widgetId": {
          "type": "string",
          "description": "Unique widget identifier."
        },
        "type": {
          "type": "string",
          "enum": ["kpi", "chart", "table"],
          "description": "Widget visualization type."
        },
        "tier": {
          "type": "integer",
          "enum": [1, 2, 3],
          "description": "Display priority. Tier 1 = always visible, Tier 2 = shown if space, Tier 3 = collapsed."
        },
        "label": {
          "type": "string",
          "description": "Display label for the widget."
        },
        "chartType": {
          "type": "string",
          "description": "Chart subtype (bar, line, donut, pie, area) when type=chart."
        },
        "dataEndpoint": {
          "type": "string",
          "description": "API endpoint that provides widget data."
        },
        "refreshIntervalSeconds": {
          "type": "integer",
          "minimum": 10,
          "description": "How often to refresh the widget data."
        },
        "privilege": {
          "type": "string",
          "description": "Privilege required to view this widget."
        }
      }
    },
    "ReportingDataSource": {
      "type": "object",
      "required": ["sourceId", "label", "fields", "dataEndpoint"],
      "properties": {
        "sourceId": {
          "type": "string"
        },
        "label": {
          "type": "string"
        },
        "description": {
          "type": "string"
        },
        "fields": {
          "type": "array",
          "items": {
            "$ref": "#/$defs/ReportingField"
          }
        },
        "dataEndpoint": {
          "type": "string"
        },
        "exportFormats": {
          "type": "array",
          "items": {
            "type": "string",
            "enum": ["csv", "xlsx", "pdf"]
          }
        }
      }
    },
    "ReportingField": {
      "type": "object",
      "required": ["field", "label", "type"],
      "properties": {
        "field": {
          "type": "string"
        },
        "label": {
          "type": "string"
        },
        "type": {
          "type": "string",
          "enum": ["string", "number", "datetime", "boolean", "enum"]
        },
        "filterable": {
          "type": "boolean"
        },
        "sortable": {
          "type": "boolean"
        },
        "aggregatable": {
          "type": "boolean"
        },
        "values": {
          "type": "array",
          "items": { "type": "string" },
          "description": "Allowed values for enum type fields."
        }
      }
    },
    "SeedProfile": {
      "type": "object",
      "properties": {
        "description": { "type": "string" },
        "records": { "type": "integer", "minimum": 0 }
      }
    },
    "PiiField": {
      "type": "object",
      "required": ["collection", "field", "piiType"],
      "properties": {
        "collection": {
          "type": "string",
          "description": "Collection/table name."
        },
        "field": {
          "type": "string",
          "description": "Field path (dot notation, supports [] for arrays)."
        },
        "piiType": {
          "type": "string",
          "enum": ["email", "phone", "national_id", "passport", "dob", "name", "address", "financial", "medical"],
          "description": "Category of PII."
        }
      }
    },
    "MetricDefinition": {
      "type": "object",
      "required": ["name", "type"],
      "properties": {
        "name": {
          "type": "string",
          "description": "Prometheus-style metric name."
        },
        "type": {
          "type": "string",
          "enum": ["counter", "histogram", "gauge"]
        },
        "labels": {
          "type": "array",
          "items": { "type": "string" },
          "description": "Label dimensions for the metric."
        },
        "description": {
          "type": "string"
        }
      }
    }
  }
}
